<?xml version="1.0" encoding="UTF-8"?>
<!DOCTYPE Change SYSTEM "http://ij.itk.org/itkfaq/ITKMigration.dtd">

<!--**
**
** RemoveInvertBinaryIntensityFunctor.xml
**
** >>>>>>>>>>>>>>>>>>>>>>>>>>>>
** THIS FILE HAS BEEN AUTOMATICALLY GENERATED. EDIT IT BEFORE COMMITING
** <<<<<<<<<<<<<<<<<<<<<<<<<<<
**
** Please, make sure this file validates the following w3c test before committing it: http://validator.w3.org
**-->
<Change>
    <!--**
    ** Title for the online migration page
    **-->
    <Title>
      Remove Invert Binary Intensity Functor
    </Title>

    <!--**
    ** The author of the change
    **-->
    <Author>
      Arnaud Gelas
    </Author>

    <!--**
    ** Date of creation for the XML document
    **-->
    <Date>
      2011-06-28
    </Date>

    <!--**
    ** Plain text description of the change
    ** Extracted from git commit messages
    **-->
    <Description>
      <![CDATA[
      Remove itk::Functor::InvertBinaryIntensityFunctor which was not used
      in the whole toolkit, and not visible for users (it did not show up in
      the doxygen documentation).

      ]]>
    </Description>

    <!--**
    ** Sample code snippets
    ** Extracted from git diff of changed files in Examples and Testing
    **-->
    <SampleCode>
      <Old>
        <![CDATA[
        ]]>
      </Old>

      <New>
        <![CDATA[
        ]]>
      </New>

    </SampleCode>

    <!--**
    ** The change-ids for all commits in the topic branch
    **-->
    <Gerrit-ChangeId>
      Ia0afc3aef203c3f1c5742553dba450d614b1c3da
    </Gerrit-ChangeId>

    <!--**
    ** List of all changed files from the topic branch
    **-->
    <FileList>
      Documentation/Migration/RemoveInvertBinaryIntensityFunctor.xml
      Modules/Filtering/DistanceMap/include/itkSignedMaurerDistanceMapImageFilter.h
      Modules/Filtering/DistanceMap/include/itkSignedMaurerDistanceMapImageFilter.txx
      Modules/Filtering/DistanceMap/itk-module.cmake
    </FileList>

    <!--**
    ** If the migration can be accomplished by a simple string
    ** substitution, then use the following construct to define
    ** the substitution rule.
    **
    ** <MigrationFix-Automatic>
    **   <Old>
    **     MipsleledName
    **   </Old>
    **   <New>
    **     MisspelledName
    **   </New>
    ** </MigrationFix-Automatic>
    **-->

    <!--**
    ** If the migration can NOT be accomplished by a simple string
    ** substitution, but potential problem spots can be identified,
    ** use the following construct to define a migration flag rule.
    **
    ** <MigrationFix-Manual>
    **   OldFunctionName
    ** </MigrationFix-Manual>
    **-->

</Change>
