<?xml version="1.0" encoding="UTF-8"?>
<!DOCTYPE Change SYSTEM "http://ij.itk.org/itkfaq/ITKMigration.dtd">
<!--**
**
** RealTimeClockAPIChanges.xml
**
**-->
<Change>
  <!--**
      ** RealTimeClock API Changes
      **-->
  <Title>
    GetTimeStamp is now private
  </Title>

  <Author>
  Luis Ibanez
  </Author>

  <!--**
      ** Plain text description of the change
      **-->
  <Description>
    The GetTimeStamp method is now private. It returns the modified
    time of the object. In prior versions, GetTimeStamp() was public
    and returned the time in seconds.
  </Description>

  <!--**
      ** Sample code snippets
      **-->
  <SampleCode>
    <Old>
      <![CDATA[
      #include "itkRealTimeClock.h"
      itk::RealTimeClock::Pointer clock = itk::RealTimeClock::New();
      double timeStart = clock->GetTimeStamp();
      ]]>
    </Old>
    <New>
      <![CDATA[
      #include "itkRealTimeClock.h"
      itk::RealTimeClock::Pointer clock = itk::RealTimeClock::New();
      itk::RealTimeClock::TimeStampType timeStart = clock->GetTimeInSeconds();
      ]]>
    </New>
  </SampleCode>

  <!--**
      ** The change-ids for all commits in the topic branch
      **-->
  <Gerrit-ChangeId>
    Ibef22c3e4cc0c45a2755289672c13d386e8096b4
  </Gerrit-ChangeId>

  <!--**
      ** List of all changed files from the topic branch
      **-->
  <FileList>
    Code/Common/itkRealTimeClock.h
    Code/Common/itkRealTimeClock.cxx
  </FileList>

<MigrationFix-Automatic>
  <Old>
    GetTimeStamp
  </Old>
  <New>
    GetTimeInSeconds
  </New>
</MigrationFix-Automatic>

</Change>
