<?xml version="1.0" encoding="UTF-8"?>
<!DOCTYPE Change SYSTEM "http://ij.itk.org/itkfaq/ITKMigration.dtd">
<!--**
**
** OrientationAdapterBaseRename.xml
**
**-->
<Change>
    <!--**
    ** Title for the online migration page
    **-->
    <Title>
      Orientation Adapter Base Rename
    </Title>

    <!--**
    ** Plain text description of the change
    **-->
    <Description>
      In order to match ITK style conventions, the filename
      should match the primary class name inside the file.
      This file was named differently than the class
      defined inside.
    </Description>

    <!--**
    ** Sample code snippets
    **-->
    <SampleCode>
      <Old>
        #include "itkOrientationAdapter.h"
      </Old>
      <New>
        #include "itkOrientationAdapterBase.h"
      </New>
    </SampleCode>

    <!--**
    ** The change-ids for all commits in the topic branch
    **-->
    <Gerrit-ChangeId>
      Ib1bfac893da630656bede6262d5415c253a51ac3
    </Gerrit-ChangeId>

    <!--**
    ** List of all changed files from the topic branch
    **-->
    <FileList>
      Code/Common/itkOrientationAdapter.h
      Code/Common/itkOrientationAdapterBase.h
      Code/Common/itkQuaternionOrientationAdapter.h
      Code/Common/itkSpatialOrientationAdapter.h
    </FileList>


<MigrationFix-Automatic>
  <Old>
  "itkOrientationAdapter.h"
  </Old>
  <New>
  "itkOrientationAdapterBase.h"
  </New>
</MigrationFix-Automatic>

</Change>
